1|Afar-Pyrenees adventure|les Escaldes, Andorra|An exciting mountain tour!|Afar|5|Podnožje:False,Proplanak:False,Vidikovac:False,Vrh:False|3|../Resources/Images/pirineji.jpg
2|This mask is very fascinating|Venice, Italy|Visit to the carnival|Serbian|30|Podnožje:True,Proplanak:False,Opanak:False,Vrh:False|12|C:/Users/GARITRU/Documents/FTN/hci/repo/Resources/Images/pirineji.jpg
3|Pearl in eye or lake?|Ohrid, North Macedonia|City break|Serbian|12|Podnožje:False,Proplanak:False,Opanak:False,Vrh:False|5|../Resources/Images/pirineji.jpg
4|Mountain air, mounatin dew|Zlatibor, Serbia|A pleasant walk|Serbian|16|Podnožje:False,Proplanak:False,Opanak:False,Vrh:False|4|../Resources/Images/pirineji.jpg
5|City of light, love and Monalisa|Paris, France|Picnic by the Eiffel|English|8|Podnožje:False,Proplanak:False,Opanak:False,Vrh:False|6|../Resources/Images/pirineji.jpg
6|UAEUAE|Dibba Al-Fujairah, United Arab Emirates|Random travell|Serbian|5|Podnožje:False,Proplanak:False,Opanak:False,Vrh:False|3|../Resources/Images/pirineji.jpg
7|UAEUAE|Dibba Al-Fujairah, United Arab Emirates|Random travell|Srpski|5|Podnožje:False,Proplanak:False,Opanak:False,Vrh:False|3|../Resources/Images/pirineji.jpg
